{
  "$schema": "https://json-schema.org/draft/2020-12/schema",
  "$id": "https://raw.githubusercontent.com/manmeetnain/design-to-ship/v1.0.0/schemas/design-project.schema.json",
  "title": "Design to Ship project",
  "type": "object",
  "required": ["project", "mode", "evidence", "requirements", "verdict"],
  "properties": {
    "project": { "type": "string", "minLength": 1 },
    "mode": {
      "enum": ["EXPLORE", "DEFINE", "DESIGN", "BUILD", "AUDIT", "FULL"]
    },
    "outcome": { "type": "string" },
    "evidence": {
      "type": "array",
      "items": {
        "type": "object",
        "required": ["id", "status", "claim"],
        "properties": {
          "id": { "type": "string", "pattern": "^E-[0-9]+$" },
          "status": {
            "enum": ["CONFIRMED", "INFERRED", "PROPOSED", "UNKNOWN", "CONFLICTING"]
          },
          "claim": { "type": "string", "minLength": 1 },
          "source": { "type": "string" }
          ,"material": { "type": "boolean", "default": true }
        },
        "additionalProperties": false
      }
    },
    "requirements": {
      "type": "array",
      "items": {
        "type": "object",
        "required": ["id", "statement", "evidence_ids"],
        "properties": {
          "id": { "type": "string", "pattern": "^R-[0-9]+$" },
          "statement": { "type": "string", "minLength": 1 },
          "evidence_ids": {
            "type": "array",
            "items": { "type": "string", "pattern": "^E-[0-9]+$" }
          },
          "acceptance_criteria": {
            "type": "array",
            "items": { "type": "string" }
          }
        },
        "additionalProperties": false
      }
    },
    "decisions": {
      "type": "array",
      "items": {
        "type": "object",
        "required": ["id", "choice", "requirement_ids", "verification"],
        "properties": {
          "id": { "type": "string", "pattern": "^D-[0-9]+$" },
          "choice": { "type": "string" },
          "requirement_ids": {
            "type": "array",
            "items": { "type": "string", "pattern": "^R-[0-9]+$" }
          },
          "alternative": { "type": "string" },
          "tradeoff": { "type": "string" },
          "verification": { "type": "string" }
        },
        "additionalProperties": false
      }
    },
    "screens": {
      "type": "array",
      "items": {
        "type": "object",
        "required": ["id", "name", "requirement_ids", "states"],
        "properties": {
          "id": { "type": "string", "pattern": "^S-[0-9]+$" },
          "name": { "type": "string", "minLength": 1 },
          "requirement_ids": {
            "type": "array",
            "items": { "type": "string", "pattern": "^R-[0-9]+$" }
          },
          "states": {
            "type": "array",
            "minItems": 1,
            "items": { "type": "string" }
          }
        },
        "additionalProperties": false
      }
    },
    "verifications": {
      "type": "array",
      "items": {
        "type": "object",
        "required": ["id", "requirement_ids", "result", "method", "evidence"],
        "properties": {
          "id": { "type": "string", "pattern": "^V-[0-9]+$" },
          "requirement_ids": {
            "type": "array",
            "items": { "type": "string", "pattern": "^R-[0-9]+$" }
          },
          "decision_ids": {
            "type": "array",
            "items": { "type": "string", "pattern": "^D-[0-9]+$" }
          },
          "result": { "enum": ["PASS", "FAIL", "PARTIAL", "NOT RUN"] },
          "method": { "type": "string", "minLength": 1 },
          "evidence": { "type": "string" }
        },
        "additionalProperties": false
      }
    },
    "verdict": {
      "enum": ["READY", "READY WITH RISKS", "REVISE", "BLOCKED"]
    }
  },
  "additionalProperties": false
}
