{"project":"Valid","mode":"AUDIT","outcome":"Verify one requirement","evidence":[{"id":"E-01","status":"CONFIRMED","claim":"Requirement supplied","material":true}],"requirements":[{"id":"R-01","statement":"Core path works","evidence_ids":["E-01"],"acceptance_criteria":["Observed result is successful"]}],"decisions":[{"id":"D-01","choice":"Use tested path","requirement_ids":["R-01"],"alternative":"Untested path","tradeoff":"Narrower scope","verification":"Exercise it"}],"verifications":[{"id":"V-01","requirement_ids":["R-01"],"decision_ids":["D-01"],"result":"PASS","method":"Automated fixture","evidence":"Observed successful fixture"}],"verdict":"READY"}
