{"project":"Empty proof","mode":"AUDIT","outcome":"Expose empty proof","evidence":[{"id":"E-01","status":"CONFIRMED","claim":"Requirement supplied","material":true}],"requirements":[{"id":"R-01","statement":"Requirement","evidence_ids":["E-01"],"acceptance_criteria":["Criterion"]}],"decisions":[{"id":"D-01","choice":"Choice","requirement_ids":["R-01"],"alternative":"Alternative","tradeoff":"Tradeoff","verification":"Check"}],"verifications":[{"id":"V-01","requirement_ids":["R-01"],"decision_ids":["D-01"],"result":"PASS","method":"Claim only","evidence":""}],"verdict":"READY WITH RISKS"}

