{"project":"Unproven","mode":"AUDIT","outcome":"Expose false readiness","evidence":[{"id":"E-01","status":"CONFIRMED","claim":"Requirement supplied","material":true}],"requirements":[{"id":"R-01","statement":"Core path works","evidence_ids":["E-01"],"acceptance_criteria":["Observed result is successful"]}],"decisions":[{"id":"D-01","choice":"Use core path","requirement_ids":["R-01"],"alternative":"Alternative","tradeoff":"Tradeoff","verification":"Exercise it"}],"verifications":[],"verdict":"READY"}
